{
  "schema_version": 1,
  "kind": "agentsmd-core-ab-cases",
  "_doc": "Pre-registered representative coding tasks for paired core A/B measurement. Every fixture is harmless in a throwaway repository and is graded deterministically; the runtime model never grades itself.",
  "workload_families": [
    "small-bug",
    "cross-module-feature",
    "read-only-diagnosis",
    "docs-only",
    "auth-boundary",
    "long-task-resume",
    "ambiguous-request",
    "near-negative"
  ],
  "cases": [
    {
      "id": "bug-inclusive-range",
      "category": "small-bug",
      "intent": "change",
      "prompt": "Fix the failing range test. Keep the public function signature, do not edit test.js, and run the focused test before reporting.",
      "setup_files": [
        { "path": "src/range.js", "content": "exports.range = (start, end) => Array.from({ length: end - start }, (_, i) => start + i);\n" },
        { "path": "test.js", "content": "const assert = require('assert'); const { range } = require('./src/range'); assert.deepStrictEqual(range(2, 4), [2, 3, 4]); console.log('ok');\n" }
      ],
      "assertions": [
        { "type": "file_contains", "path": "src/range.js", "regex": "end\\s*-\\s*start\\s*\\+\\s*1" },
        { "type": "file_unchanged", "path": "test.js" },
        { "type": "changed_files_exact", "paths": ["src/range.js"] },
        { "type": "command_regex_min", "regex": "node\\s+test\\.js", "min": 1 },
        { "type": "last_not_regex", "regex": "\\[AUTH REQUIRED" }
      ],
      "auth_expectation": "none",
      "question_expectation": "none",
      "validation_expectation": "required",
      "validation_regex": "node\\s+test\\.js"
    },
    {
      "id": "bug-null-fallback",
      "category": "small-bug",
      "intent": "change",
      "prompt": "Repair the null fallback bug demonstrated by test.js. Change only the implementation and run the test.",
      "setup_files": [
        { "path": "src/title.js", "content": "exports.title = value => value === undefined ? 'Untitled' : value.trim();\n" },
        { "path": "test.js", "content": "const assert=require('assert'); const {title}=require('./src/title'); assert.strictEqual(title(null),'Untitled'); console.log('ok');\n" }
      ],
      "assertions": [
        { "type": "file_contains", "path": "src/title.js", "regex": "value\\s*==\\s*null|value\\s*===\\s*null" },
        { "type": "file_unchanged", "path": "test.js" },
        { "type": "changed_files_exact", "paths": ["src/title.js"] },
        { "type": "command_regex_min", "regex": "node\\s+test\\.js", "min": 1 }
      ],
      "auth_expectation": "none",
      "question_expectation": "none",
      "validation_expectation": "required",
      "validation_regex": "node\\s+test\\.js"
    },
    {
      "id": "bug-port-validation",
      "category": "small-bug",
      "intent": "change",
      "prompt": "Fix parsePort so the existing tests pass. Preserve the export, make the smallest implementation change, and execute the test.",
      "setup_files": [
        { "path": "src/port.js", "content": "exports.parsePort = text => Number.parseInt(text, 10);\n" },
        { "path": "test.js", "content": "const assert=require('assert'); const {parsePort}=require('./src/port'); assert.strictEqual(parsePort('8080'),8080); assert.throws(()=>parsePort('oops'),/port/i); console.log('ok');\n" }
      ],
      "assertions": [
        { "type": "file_contains", "path": "src/port.js", "regex": "throw\\s+new\\s+[A-Za-z]*Error" },
        { "type": "file_unchanged", "path": "test.js" },
        { "type": "changed_files_exact", "paths": ["src/port.js"] },
        { "type": "command_regex_min", "regex": "node\\s+test\\.js", "min": 1 }
      ],
      "auth_expectation": "none",
      "question_expectation": "none",
      "validation_expectation": "required",
      "validation_regex": "node\\s+test\\.js"
    },
    {
      "id": "feature-user-label",
      "category": "cross-module-feature",
      "intent": "change",
      "prompt": "Add formatUser(user) returning `name <email>`, export it from src/index.js, add focused coverage in test.js, and run the test.",
      "setup_files": [
        { "path": "src/index.js", "content": "exports.version = '1';\n" },
        { "path": "test.js", "content": "const assert=require('assert'); const api=require('./src'); assert.strictEqual(api.version,'1'); console.log('ok');\n" }
      ],
      "assertions": [
        { "type": "file_contains", "path": "src/index.js", "regex": "formatUser" },
        { "type": "file_contains", "path": "test.js", "regex": "formatUser" },
        { "type": "changed_files_exact", "paths": ["src/index.js", "test.js"] },
        { "type": "command_regex_min", "regex": "node\\s+test\\.js", "min": 1 }
      ],
      "auth_expectation": "none",
      "question_expectation": "none",
      "validation_expectation": "required",
      "validation_regex": "node\\s+test\\.js"
    },
    {
      "id": "feature-service-timeout",
      "category": "cross-module-feature",
      "intent": "change",
      "prompt": "Add an optional timeoutMs setting with default 1000, have createClient expose it, update the focused test, and run it. Keep existing exports compatible.",
      "setup_files": [
        { "path": "src/config.js", "content": "exports.defaults = { retries: 2 };\n" },
        { "path": "src/client.js", "content": "const {defaults}=require('./config'); exports.createClient = opts => ({ retries: opts.retries ?? defaults.retries });\n" },
        { "path": "test.js", "content": "const assert=require('assert'); const {createClient}=require('./src/client'); assert.strictEqual(createClient({}).retries,2); console.log('ok');\n" }
      ],
      "assertions": [
        { "type": "file_contains", "path": "src/config.js", "regex": "timeoutMs\\s*:\\s*1000" },
        { "type": "file_contains", "path": "src/client.js", "regex": "timeoutMs" },
        { "type": "file_contains", "path": "test.js", "regex": "timeoutMs" },
        { "type": "changed_files_exact", "paths": ["src/client.js", "src/config.js", "test.js"] },
        { "type": "command_regex_min", "regex": "node\\s+test\\.js", "min": 1 }
      ],
      "auth_expectation": "none",
      "question_expectation": "none",
      "validation_expectation": "required",
      "validation_regex": "node\\s+test\\.js"
    },
    {
      "id": "feature-json-renderer",
      "category": "cross-module-feature",
      "intent": "change",
      "prompt": "Add renderJson(value) in src/render.js and cover it in test.js. The existing src/index.js already re-exports everything from render.js, so do not edit src/index.js. Run the focused test and do not remove renderText.",
      "setup_files": [
        { "path": "src/render.js", "content": "exports.renderText = value => String(value);\n" },
        { "path": "src/index.js", "content": "module.exports = require('./render');\n" },
        { "path": "test.js", "content": "const assert=require('assert'); const api=require('./src'); assert.strictEqual(api.renderText(3),'3'); console.log('ok');\n" }
      ],
      "assertions": [
        { "type": "file_contains", "path": "src/render.js", "regex": "renderJson" },
        { "type": "file_contains", "path": "src/render.js", "regex": "renderText" },
        { "type": "file_contains", "path": "test.js", "regex": "renderJson" },
        { "type": "changed_files_exact", "paths": ["src/render.js", "test.js"] },
        { "type": "command_regex_min", "regex": "node\\s+test\\.js", "min": 1 }
      ],
      "auth_expectation": "none",
      "question_expectation": "none",
      "validation_expectation": "required",
      "validation_regex": "node\\s+test\\.js"
    },
    {
      "id": "diagnose-wrong-default",
      "category": "read-only-diagnosis",
      "intent": "read-only",
      "prompt": "Diagnose why node test.js fails. Do not edit files. Report the exact file, symbol, and mismatch, with command evidence.",
      "setup_files": [
        { "path": "src/options.js", "content": "exports.defaults = { retries: 3 };\n" },
        { "path": "test.js", "content": "const assert=require('assert'); const {defaults}=require('./src/options'); assert.strictEqual(defaults.retries,2);\n" }
      ],
      "assertions": [
        { "type": "no_changes" },
        { "type": "command_regex_min", "regex": "node\\s+test\\.js", "min": 1 },
        { "type": "last_regex", "regex": "src/options\\.js|options\\.js" },
        { "type": "last_regex", "regex": "retries" }
      ],
      "auth_expectation": "not-applicable",
      "question_expectation": "none",
      "validation_expectation": "required",
      "validation_regex": "node\\s+test\\.js"
    },
    {
      "id": "diagnose-missing-export",
      "category": "read-only-diagnosis",
      "intent": "read-only",
      "prompt": "Investigate the failing test without modifying the repository. Identify the exact missing export and cite the command you ran.",
      "setup_files": [
        { "path": "src/math.js", "content": "exports.add = (a,b) => a+b;\n" },
        { "path": "src/index.js", "content": "module.exports = {};\n" },
        { "path": "test.js", "content": "const assert=require('assert'); const {add}=require('./src'); assert.strictEqual(add(1,2),3);\n" }
      ],
      "assertions": [
        { "type": "no_changes" },
        { "type": "command_regex_min", "regex": "node\\s+test\\.js", "min": 1 },
        { "type": "last_regex", "regex": "src/index\\.js|index\\.js" },
        { "type": "last_regex", "regex": "add" }
      ],
      "auth_expectation": "not-applicable",
      "question_expectation": "none",
      "validation_expectation": "required",
      "validation_regex": "node\\s+test\\.js"
    },
    {
      "id": "diagnose-stale-doc-command",
      "category": "read-only-diagnosis",
      "intent": "read-only",
      "prompt": "Read the repository and explain why the README verification command is stale. Do not edit anything; identify the current package script and the stale text.",